{"currency":"CNY","engine_semantics_version":"0.4.0-next_open_basket","generated_at":"1970-01-01T00:00:00+08:00","nav_series":[{"cash":100000.0,"positions_count":0,"positions_value":0.0,"total_value":100000.0,"trading_date":"2026-01-06"},{"cash":3042.4,"positions_count":3,"positions_value":96957.6,"total_value":100000.0,"trading_date":"2026-01-07"},{"cash":3042.4,"positions_count":3,"positions_value":96957.6,"total_value":100000.0,"trading_date":"2026-01-08"}],"schema_version":"1.0","source_digest_ref":"7f662b42ad18f9be855e4796c313b348c55527fc456c3e6c6fae6501e37b6fbe","strategy_id":"etf_regression_rotation_v1","timezone":"Asia/Shanghai"}